<?xml version="1.0" encoding="UTF-8"?>
<!DOCTYPE data SYSTEM "../../../lib/pkp/dtd/xmlData.dtd">

<!--
	* dbscripts/xml/upgrade/3.2.0_preupdate_versioning.xml
	*
	* Copyright (c) 2013-2019 Simon Fraser University
	* Copyright (c) 2003-2019 John Willinsky
	* Distributed under the GNU GPL v2. For full terms see the file docs/COPYING.
	*
	* Copy submission data to temporary tables so it can be updated
	* after the publication table modifications are made.
	*
	-->

<data>
	<sql>
		<query>CREATE TABLE temp_authors AS SELECT * FROM authors</query>
		<query>CREATE TABLE temp_submissions AS SELECT * FROM submissions</query>
		<query>CREATE TABLE temp_submission_categories AS SELECT * FROM submission_categories</query>
		<query>CREATE TABLE temp_publication_formats AS SELECT * FROM publication_formats</query>
		<query>CREATE TABLE temp_submission_chapters AS SELECT * FROM submission_chapters</query>
		<query>CREATE TABLE temp_published_submissions AS SELECT * FROM published_submissions</query>
	</sql>
</data>
